{"bundleVersion":"1.0.0","createdAt":"2015-11-20T02:54:14.000Z","build":{"version":"local-dev","commit":"unknown","target":"unknown-target"},"files":[{"path":"schemas/capability-manifest.schema.json","sha256":"ae0f48a4dfff792fb58f40ceebc908aaf69abbc08998daddb9282635e521c81b","contentBase64":"ewogICIkc2NoZW1hIjogImh0dHBzOi8vanNvbi1zY2hlbWEub3JnL2RyYWZ0LzIwMjAtMTIvc2NoZW1hIiwKICAiJGlkIjogImh0dHBzOi8vY29kZXhtb25pdG9yLmxvY2FsL2NvbnRyYWN0cy9jb2RleC9jYXBhYmlsaXR5LW1hbmlmZXN0LnNjaGVtYS5qc29uIiwKICAidGl0bGUiOiAiQ29kZXggQXBwLVNlcnZlciBDYXBhYmlsaXR5IE1hbmlmZXN0IiwKICAidHlwZSI6ICJvYmplY3QiLAogICJyZXF1aXJlZCI6IFsKICAgICJzY2hlbWFWZXJzaW9uIiwKICAgICJnZW5lcmF0ZWRBdCIsCiAgICAic2VydmVyIiwKICAgICJjb21wYXRpYmlsaXR5IiwKICAgICJjYXBhYmlsaXRpZXMiCiAgXSwKICAicHJvcGVydGllcyI6IHsKICAgICJzY2hlbWFWZXJzaW9uIjogewogICAgICAidHlwZSI6ICJzdHJpbmciLAogICAgICAicGF0dGVybiI6ICJeMVxcLlswLTldK1xcLlswLTldKyQiCiAgICB9LAogICAgImdlbmVyYXRlZEF0IjogewogICAgICAidHlwZSI6ICJzdHJpbmciLAogICAgICAiZm9ybWF0IjogImRhdGUtdGltZSIKICAgIH0sCiAgICAic2VydmVyIjogewogICAgICAidHlwZSI6ICJvYmplY3QiLAogICAgICAicmVxdWlyZWQiOiBbInByb3RvY29sVmVyc2lvbiIsICJidWlsZFZlcnNpb24iLCAiY29tbWl0IiwgInRhcmdldCJdLAogICAgICAicHJvcGVydGllcyI6IHsKICAgICAgICAicHJvdG9jb2xWZXJzaW9uIjogewogICAgICAgICAgInR5cGUiOiAic3RyaW5nIiwKICAgICAgICAgICJwYXR0ZXJuIjogIl5bMC05XStcXC5bMC05XStcXC5bMC05XSskIgogICAgICAgIH0sCiAgICAgICAgImJ1aWxkVmVyc2lvbiI6IHsKICAgICAgICAgICJ0eXBlIjogInN0cmluZyIsCiAgICAgICAgICAibWluTGVuZ3RoIjogMQogICAgICAgIH0sCiAgICAgICAgImNvbW1pdCI6IHsKICAgICAgICAgICJ0eXBlIjogInN0cmluZyIsCiAgICAgICAgICAibWluTGVuZ3RoIjogNwogICAgICAgIH0sCiAgICAgICAgInRhcmdldCI6IHsKICAgICAgICAgICJ0eXBlIjogInN0cmluZyIsCiAgICAgICAgICAibWluTGVuZ3RoIjogMQogICAgICAgIH0KICAgICAgfSwKICAgICAgImFkZGl0aW9uYWxQcm9wZXJ0aWVzIjogdHJ1ZQogICAgfSwKICAgICJjb21wYXRpYmlsaXR5IjogewogICAgICAidHlwZSI6ICJvYmplY3QiLAogICAgICAicmVxdWlyZWQiOiBbIm1pbmltdW1DbGllbnRQcm90b2NvbCIsICJtYXhpbXVtQ2xpZW50UHJvdG9jb2wiXSwKICAgICAgInByb3BlcnRpZXMiOiB7CiAgICAgICAgIm1pbmltdW1DbGllbnRQcm90b2NvbCI6IHsKICAgICAgICAgICJ0eXBlIjogInN0cmluZyIsCiAgICAgICAgICAicGF0dGVybiI6ICJeWzAtOV0rXFwuWzAtOV0rXFwuWzAtOV0rJCIKICAgICAgICB9LAogICAgICAgICJtYXhpbXVtQ2xpZW50UHJvdG9jb2wiOiB7CiAgICAgICAgICAidHlwZSI6ICJzdHJpbmciLAogICAgICAgICAgInBhdHRlcm4iOiAiXlswLTldK1xcLlswLTldK1xcLlswLTldKyQiCiAgICAgICAgfQogICAgICB9LAogICAgICAiYWRkaXRpb25hbFByb3BlcnRpZXMiOiB0cnVlCiAgICB9LAogICAgImNhcGFiaWxpdGllcyI6IHsKICAgICAgInR5cGUiOiAiYXJyYXkiLAogICAgICAiaXRlbXMiOiB7CiAgICAgICAgIiRyZWYiOiAiIy8kZGVmcy9jYXBhYmlsaXR5IgogICAgICB9CiAgICB9CiAgfSwKICAiJGRlZnMiOiB7CiAgICAibWV0aG9kU2V0IjogewogICAgICAidHlwZSI6ICJvYmplY3QiLAogICAgICAicHJvcGVydGllcyI6IHsKICAgICAgICAiY2xpZW50UmVxdWVzdHMiOiB7CiAgICAgICAgICAidHlwZSI6ICJhcnJheSIsCiAgICAgICAgICAiaXRlbXMiOiB7ICJ0eXBlIjogInN0cmluZyIsICJtaW5MZW5ndGgiOiAxIH0sCiAgICAgICAgICAidW5pcXVlSXRlbXMiOiB0cnVlCiAgICAgICAgfSwKICAgICAgICAic2VydmVyUmVxdWVzdHMiOiB7CiAgICAgICAgICAidHlwZSI6ICJhcnJheSIsCiAgICAgICAgICAiaXRlbXMiOiB7ICJ0eXBlIjogInN0cmluZyIsICJtaW5MZW5ndGgiOiAxIH0sCiAgICAgICAgICAidW5pcXVlSXRlbXMiOiB0cnVlCiAgICAgICAgfSwKICAgICAgICAibm90aWZpY2F0aW9ucyI6IHsKICAgICAgICAgICJ0eXBlIjogImFycmF5IiwKICAgICAgICAgICJpdGVtcyI6IHsgInR5cGUiOiAic3RyaW5nIiwgIm1pbkxlbmd0aCI6IDEgfSwKICAgICAgICAgICJ1bmlxdWVJdGVtcyI6IHRydWUKICAgICAgICB9CiAgICAgIH0sCiAgICAgICJhZGRpdGlvbmFsUHJvcGVydGllcyI6IGZhbHNlCiAgICB9LAogICAgInJlYXNvbiI6IHsKICAgICAgInR5cGUiOiAib2JqZWN0IiwKICAgICAgInJlcXVpcmVkIjogWyJjb2RlIiwgIm1lc3NhZ2UiXSwKICAgICAgInByb3BlcnRpZXMiOiB7CiAgICAgICAgImNvZGUiOiB7CiAgICAgICAgICAidHlwZSI6ICJzdHJpbmciLAogICAgICAgICAgInBhdHRlcm4iOiAiXlthLXpdW2EtejAtOV8uLV0rJCIKICAgICAgICB9LAogICAgICAgICJtZXNzYWdlIjogewogICAgICAgICAgInR5cGUiOiAic3RyaW5nIiwKICAgICAgICAgICJtaW5MZW5ndGgiOiAxCiAgICAgICAgfSwKICAgICAgICAicmVtZWRpYXRpb24iOiB7CiAgICAgICAgICAidHlwZSI6ICJzdHJpbmciLAogICAgICAgICAgIm1pbkxlbmd0aCI6IDEKICAgICAgICB9LAogICAgICAgICJtaW5pbXVtU2VydmVyVmVyc2lvbiI6IHsKICAgICAgICAgICJ0eXBlIjogInN0cmluZyIsCiAgICAgICAgICAibWluTGVuZ3RoIjogMQogICAgICAgIH0KICAgICAgfSwKICAgICAgImFkZGl0aW9uYWxQcm9wZXJ0aWVzIjogdHJ1ZQogICAgfSwKICAgICJjYXBhYmlsaXR5IjogewogICAgICAidHlwZSI6ICJvYmplY3QiLAogICAgICAicmVxdWlyZWQiOiBbImlkIiwgInZlcnNpb24iLCAic3RhdHVzIiwgIm1ldGhvZHMiXSwKICAgICAgInByb3BlcnRpZXMiOiB7CiAgICAgICAgImlkIjogewogICAgICAgICAgInR5cGUiOiAic3RyaW5nIiwKICAgICAgICAgICJwYXR0ZXJuIjogIl5bYS16XVthLXowLTlfXSooPzpcXC5bYS16XVthLXowLTlfXSopKyQiCiAgICAgICAgfSwKICAgICAgICAidmVyc2lvbiI6IHsKICAgICAgICAgICJ0eXBlIjogInN0cmluZyIsCiAgICAgICAgICAicGF0dGVybiI6ICJeWzAtOV0rXFwuWzAtOV0rXFwuWzAtOV0rJCIKICAgICAgICB9LAogICAgICAgICJzdGF0dXMiOiB7CiAgICAgICAgICAiZW51bSI6IFsKICAgICAgICAgICAgInN1cHBvcnRlZCIsCiAgICAgICAgICAgICJ1bnN1cHBvcnRlZCIsCiAgICAgICAgICAgICJkZWdyYWRlZCIsCiAgICAgICAgICAgICJpbmNvbXBhdGlibGUiLAogICAgICAgICAgICAiZXhwZXJpbWVudGFsIgogICAgICAgICAgXQogICAgICAgIH0sCiAgICAgICAgImV4cGVyaW1lbnRhbCI6IHsKICAgICAgICAgICJ0eXBlIjogImJvb2xlYW4iCiAgICAgICAgfSwKICAgICAgICAibWV0aG9kcyI6IHsKICAgICAgICAgICIkcmVmIjogIiMvJGRlZnMvbWV0aG9kU2V0IgogICAgICAgIH0sCiAgICAgICAgImxpbWl0cyI6IHsKICAgICAgICAgICJ0eXBlIjogIm9iamVjdCIsCiAgICAgICAgICAiYWRkaXRpb25hbFByb3BlcnRpZXMiOiB7CiAgICAgICAgICAgICJ0eXBlIjogWyJzdHJpbmciLCAibnVtYmVyIiwgImludGVnZXIiLCAiYm9vbGVhbiIsICJudWxsIl0KICAgICAgICAgIH0KICAgICAgICB9LAogICAgICAgICJyZWFzb24iOiB7CiAgICAgICAgICAiJHJlZiI6ICIjLyRkZWZzL3JlYXNvbiIKICAgICAgICB9LAogICAgICAgICJtZXRhZGF0YSI6IHsKICAgICAgICAgICJ0eXBlIjogIm9iamVjdCIsCiAgICAgICAgICAiYWRkaXRpb25hbFByb3BlcnRpZXMiOiB0cnVlCiAgICAgICAgfQogICAgICB9LAogICAgICAiYWxsT2YiOiBbCiAgICAgICAgewogICAgICAgICAgImlmIjogewogICAgICAgICAgICAicHJvcGVydGllcyI6IHsKICAgICAgICAgICAgICAic3RhdHVzIjogewogICAgICAgICAgICAgICAgImVudW0iOiBbInVuc3VwcG9ydGVkIiwgImRlZ3JhZGVkIiwgImluY29tcGF0aWJsZSJdCiAgICAgICAgICAgICAgfQogICAgICAgICAgICB9LAogICAgICAgICAgICAicmVxdWlyZWQiOiBbInN0YXR1cyJdCiAgICAgICAgICB9LAogICAgICAgICAgInRoZW4iOiB7CiAgICAgICAgICAgICJyZXF1aXJlZCI6IFsicmVhc29uIl0KICAgICAgICAgIH0KICAgICAgICB9LAogICAgICAgIHsKICAgICAgICAgICJpZiI6IHsKICAgICAgICAgICAgInByb3BlcnRpZXMiOiB7CiAgICAgICAgICAgICAgInN0YXR1cyI6IHsgImNvbnN0IjogImV4cGVyaW1lbnRhbCIgfQogICAgICAgICAgICB9LAogICAgICAgICAgICAicmVxdWlyZWQiOiBbInN0YXR1cyJdCiAgICAgICAgICB9LAogICAgICAgICAgInRoZW4iOiB7CiAgICAgICAgICAgICJwcm9wZXJ0aWVzIjogewogICAgICAgICAgICAgICJleHBlcmltZW50YWwiOiB7ICJjb25zdCI6IHRydWUgfQogICAgICAgICAgICB9LAogICAgICAgICAgICAicmVxdWlyZWQiOiBbImV4cGVyaW1lbnRhbCJdCiAgICAgICAgICB9CiAgICAgICAgfQogICAgICBdLAogICAgICAiYWRkaXRpb25hbFByb3BlcnRpZXMiOiB0cnVlCiAgICB9CiAgfSwKICAiYWRkaXRpb25hbFByb3BlcnRpZXMiOiB0cnVlCn0K"},{"path":"manifest/capability-manifest.json","sha256":"ca1f485daef0210200b1a15e4526ea172ed505efe7fe4e7f520fea88391db3e0","contentBase64":"ewogICJzY2hlbWFWZXJzaW9uIjogIjEuMC4wIiwKICAiZ2VuZXJhdGVkQXQiOiAiMjAyNi0wNy0xMlQwMDowMDowMFoiLAogICJzZXJ2ZXIiOiB7CiAgICAicHJvdG9jb2xWZXJzaW9uIjogIjIuMC4wIiwKICAgICJidWlsZFZlcnNpb24iOiAiZml4dHVyZS12MSIsCiAgICAiY29tbWl0IjogIjAwMDAwMDAwMDAwMDAwMDAwMDAwMDAwMDAwMDAwMDAwMDAwMDAwMDAiLAogICAgInRhcmdldCI6ICJ4ODZfNjQtdW5rbm93bi1saW51eC1nbnUiCiAgfSwKICAiY29tcGF0aWJpbGl0eSI6IHsKICAgICJtaW5pbXVtQ2xpZW50UHJvdG9jb2wiOiAiMS4wLjAiLAogICAgIm1heGltdW1DbGllbnRQcm90b2NvbCI6ICIxLjAuMCIKICB9LAogICJjYXBhYmlsaXRpZXMiOiBbCiAgICB7CiAgICAgICJpZCI6ICJwcm90b2NvbC5pbml0aWFsaXplIiwKICAgICAgInZlcnNpb24iOiAiMS4wLjAiLAogICAgICAic3RhdHVzIjogInN1cHBvcnRlZCIsCiAgICAgICJtZXRob2RzIjogewogICAgICAgICJjbGllbnRSZXF1ZXN0cyI6IFsiaW5pdGlhbGl6ZSJdLAogICAgICAgICJub3RpZmljYXRpb25zIjogWyJpbml0aWFsaXplZCJdCiAgICAgIH0sCiAgICAgICJsaW1pdHMiOiB7fQogICAgfSwKICAgIHsKICAgICAgImlkIjogInRocmVhZC5saWZlY3ljbGUiLAogICAgICAidmVyc2lvbiI6ICIxLjAuMCIsCiAgICAgICJzdGF0dXMiOiAic3VwcG9ydGVkIiwKICAgICAgIm1ldGhvZHMiOiB7CiAgICAgICAgImNsaWVudFJlcXVlc3RzIjogWwogICAgICAgICAgInRocmVhZC9zdGFydCIsCiAgICAgICAgICAidGhyZWFkL3JlYWQiLAogICAgICAgICAgInRocmVhZC9yZXN1bWUiLAogICAgICAgICAgInRocmVhZC9saXN0IiwKICAgICAgICAgICJ0aHJlYWQvYXJjaGl2ZSIKICAgICAgICBdLAogICAgICAgICJub3RpZmljYXRpb25zIjogWwogICAgICAgICAgInRocmVhZC9zdGFydGVkIiwKICAgICAgICAgICJ0aHJlYWQvc3RhdHVzL2NoYW5nZWQiLAogICAgICAgICAgInRocmVhZC9hcmNoaXZlZCIKICAgICAgICBdCiAgICAgIH0sCiAgICAgICJsaW1pdHMiOiB7CiAgICAgICAgIm1heENvbmN1cnJlbnRUaHJlYWRzIjogMTYKICAgICAgfQogICAgfSwKICAgIHsKICAgICAgImlkIjogInR1cm4ubGlmZWN5Y2xlIiwKICAgICAgInZlcnNpb24iOiAiMS4wLjAiLAogICAgICAic3RhdHVzIjogInN1cHBvcnRlZCIsCiAgICAgICJtZXRob2RzIjogewogICAgICAgICJjbGllbnRSZXF1ZXN0cyI6IFsidHVybi9zdGFydCIsICJ0dXJuL3N0ZWVyIiwgInR1cm4vaW50ZXJydXB0Il0sCiAgICAgICAgIm5vdGlmaWNhdGlvbnMiOiBbInR1cm4vc3RhcnRlZCIsICJ0dXJuL2NvbXBsZXRlZCJdCiAgICAgIH0sCiAgICAgICJsaW1pdHMiOiB7fQogICAgfSwKICAgIHsKICAgICAgImlkIjogImFwcHJvdmFsLmxpZmVjeWNsZSIsCiAgICAgICJ2ZXJzaW9uIjogIjEuMC4wIiwKICAgICAgInN0YXR1cyI6ICJzdXBwb3J0ZWQiLAogICAgICAibWV0aG9kcyI6IHsKICAgICAgICAic2VydmVyUmVxdWVzdHMiOiBbCiAgICAgICAgICAiaXRlbS9jb21tYW5kRXhlY3V0aW9uL3JlcXVlc3RBcHByb3ZhbCIsCiAgICAgICAgICAiaXRlbS9maWxlQ2hhbmdlL3JlcXVlc3RBcHByb3ZhbCIsCiAgICAgICAgICAiaXRlbS9wZXJtaXNzaW9ucy9yZXF1ZXN0QXBwcm92YWwiLAogICAgICAgICAgIml0ZW0vdG9vbC9yZXF1ZXN0VXNlcklucHV0IgogICAgICAgIF0KICAgICAgfSwKICAgICAgImxpbWl0cyI6IHt9CiAgICB9LAogICAgewogICAgICAiaWQiOiAicHJvZmlsZS5tdWx0aV93b3Jrc3BhY2UiLAogICAgICAidmVyc2lvbiI6ICIxLjAuMCIsCiAgICAgICJzdGF0dXMiOiAiZGVncmFkZWQiLAogICAgICAibWV0aG9kcyI6IHsKICAgICAgICAiY2xpZW50UmVxdWVzdHMiOiBbInRocmVhZC9zdGFydCIsICJ0aHJlYWQvbGlzdCJdCiAgICAgIH0sCiAgICAgICJsaW1pdHMiOiB7CiAgICAgICAgIm1heFdvcmtzcGFjZXNQZXJQcm9maWxlIjogOAogICAgICB9LAogICAgICAicmVhc29uIjogewogICAgICAgICJjb2RlIjogInByb2ZpbGUucmVnaXN0cmF0aW9uLnBhcnRpYWwiLAogICAgICAgICJtZXNzYWdlIjogIkV4cGxpY2l0IFdvcmtzcGFjZSByZWdpc3RyYXRpb24gbWV0aG9kcyBhcmUgbm90IGF2YWlsYWJsZSBpbiB0aGlzIGZpeHR1cmUuIiwKICAgICAgICAicmVtZWRpYXRpb24iOiAiSW5zdGFsbCBhIGJ1aWxkIHRoYXQgaW1wbGVtZW50cyBDUi0xMDEgYW5kIENSLTEwMi4iCiAgICAgIH0KICAgIH0sCiAgICB7CiAgICAgICJpZCI6ICJtZW1vcnkubGlmZWN5Y2xlIiwKICAgICAgInZlcnNpb24iOiAiMS4wLjAiLAogICAgICAic3RhdHVzIjogInVuc3VwcG9ydGVkIiwKICAgICAgIm1ldGhvZHMiOiB7fSwKICAgICAgImxpbWl0cyI6IHt9LAogICAgICAicmVhc29uIjogewogICAgICAgICJjb2RlIjogIm1lbW9yeS5icmlkZ2UubWlzc2luZyIsCiAgICAgICAgIm1lc3NhZ2UiOiAiTWVtb3J5IHN0YXR1cywgZXhwb3J0IGFuZCByZXNldCBhcmUgdW5hdmFpbGFibGUuIiwKICAgICAgICAicmVtZWRpYXRpb24iOiAiSW5zdGFsbCBhIGJ1aWxkIHRoYXQgaW1wbGVtZW50cyBDUi0xMDQgdGhyb3VnaCBDUi0xMDguIgogICAgICB9CiAgICB9LAogICAgewogICAgICAiaWQiOiAiYWd